Fase,Actividad,CMMI
Obtención,Preguntar e identificar las problemáticas que enfrentan los socios que quieran ser abordadas en el proyecto.,RM 1.1
Obtención,Identificar las necesidades que requieran y puedan solucionarle bajo el alcance del proyecto.,RM 1.1
Análisis,Evaluar si las necesidades descritas por los socios atacan la problemática descrita anteriormente.,RM 1.1
Análisis,Priorizar las necesidades con base a la información descrita por los socios.,"RM 1.1
RM 1.2"
Análisis,Extraer los requisitos para satisfacer las necesidades,RM 1.1
Análisis,Estimar el costo de cada unos de los requisitos y priorizar en base a las necesidades,RM 1.2
Análisis,Evaluar el impacto de acuerdo a los criterios de aceptación de requisitos. Generar propuestas de cambio en caso de no cumplan con dichos criterios.,"RM 1.2
RM 1.3"
Verificación,"Exponer y validar los requisitos analizados a los Stakeholders. Tomar la retroalimentación, y en caso de que algún requisito deberá de repetir el proceso.","RM 1.1
RM 1.2
RM 1.3"