Proyecto,Titulo,Hipotesis,Fecha de evaluación,Tipo de mejora,Completada,Resultados,Autor
Nefro,Conectar base de datos a Digital Ocean,Reduicir el tiempo invertido,,"Aumentar Flujo de Valor, Reducir tamaño de ciclos de retroalimentación",No,,Jorge Alan Ramírez Elías
Nefro,Definir Horario de trabajo,,,Aumentar Flujo de Valor,No,,Jorge Alan Ramírez Elías
Nefro,Agregar Eslint,,,Reducir tamaño de ciclos de retroalimentación,No,,Jorge Alan Ramírez Elías
Departamental,Crear board de propuestas,,,Reducir tamaño de ciclos de retroalimentación,No,,Jorge Alan Ramírez Elías
Monarca,"../Wiki%204abacc0cd1bc4933b885625597ed9fd1/Politicas%20d2cd71f3c48c456e9a38a16b2508b6b9/BJPO02_Poli%CC%81tica%20de%20ayuda%209cdbff2d4e774e6bae4907745d0fd83d.md ","Si los miembros del equipo piden ayuda cuando el costo de resolver problemas es mayor al que se define en la política de ayuda, el CPI del proyecto se reducirá en 5 días. El valor actual: es 1.36778.",,Aumentar Flujo de Valor,No,,Mariana Soto Ochoa